{
  "kind": "nf-domain-spec/1",
  "code": "E13",
  "domain": "代码与软件工程",
  "section": "E · 人机与内容创作",
  "anchors_verified_on": "2026-09-22",
  "standard_anchors_verified_on": "2026-09-24",
  "metric_family": "preference",
  "content_tier": "derived",
  "data_authenticity": {
    "standard_bindings": 24,
    "in_catalog_ratio": 1.0,
    "reachable_ratio": 1.0,
    "probe_evidence_ratio": 1.0,
    "anchor_probed_ratio": 1.0,
    "score": 1.0,
    "threshold": 0.95,
    "bound_standards": [
      "commonmark",
      "cwe",
      "eu-machinery",
      "ietf-json-schema",
      "mermaid",
      "osi-osd",
      "owasp-llm",
      "peps",
      "spdx-3",
      "vega-lite",
      "w3c-epub33",
      "w3c-tabular-data"
    ]
  },
  "subdivisions": [
    {
      "id": "E13-01",
      "name": "需求转代码",
      "definition": "需求转代码：口径 = 产出形态 / 目标受众 / 一致性规则 / 机验方式 四件齐备（本条目按 E 段口径框架登记，领域细则待作者补全）。",
      "anchor": "https://peps.python.org/pep-0008/",
      "anchor_kind": "spec",
      "anchor_status": 200,
      "standard_ref": "peps",
      "standard_why": "域码 E13 专属绑定（轮换 0）",
      "standards": [
        {
          "ref": "peps",
          "role": "primary",
          "why": "域码 E13 专属绑定（轮换 0）",
          "layer": "eng",
          "body": "Python",
          "reachable": true,
          "http_status": 200,
          "probe_date": "2026-09-24",
          "depends_on": [
            "rst-docutils"
          ]
        },
        {
          "ref": "ietf-json-schema",
          "role": "support",
          "why": "E 段载体锚（轮换 0；与主锚异层）",
          "layer": "data",
          "body": "IETF/JSON Schema",
          "reachable": true,
          "http_status": 200,
          "probe_date": "2026-09-24",
          "depends_on": [
            "ietf-json"
          ]
        }
      ],
      "check": "声明 形态清单 / 受众与可读性口径 / 跨件一致规则 / 可机验项；四项缺一即判「口径未定」（本判据为段级框架，领域专属判据待补）。",
      "pitfall": "只评「好看好用」无判据；跨件风格漂移无规则（E 段常见失效模式；领域专属失效模式待补）。"
    },
    {
      "id": "E13-02",
      "name": "补全与重构",
      "definition": "补全与重构：口径 = 产出形态 / 目标受众 / 一致性规则 / 机验方式 四件齐备（本条目按 E 段口径框架登记，领域细则待作者补全）。",
      "anchor": "https://peps.python.org/pep-0008/",
      "anchor_kind": "spec",
      "anchor_status": 200,
      "standard_ref": "osi-osd",
      "standard_why": "域码 E13 专属绑定（轮换 1）",
      "standards": [
        {
          "ref": "osi-osd",
          "role": "primary",
          "why": "域码 E13 专属绑定（轮换 1）",
          "layer": "gov",
          "body": "OSI",
          "reachable": true,
          "http_status": 200,
          "probe_date": "2026-09-24",
          "depends_on": []
        },
        {
          "ref": "commonmark",
          "role": "support",
          "why": "E 段载体锚（轮换 1；与主锚异层）",
          "layer": "form",
          "body": "CommonMark",
          "reachable": true,
          "http_status": 200,
          "probe_date": "2026-09-24",
          "depends_on": []
        }
      ],
      "check": "声明 形态清单 / 受众与可读性口径 / 跨件一致规则 / 可机验项；四项缺一即判「口径未定」（本判据为段级框架，领域专属判据待补）。",
      "pitfall": "只评「好看好用」无判据；跨件风格漂移无规则（E 段常见失效模式；领域专属失效模式待补）。"
    },
    {
      "id": "E13-03",
      "name": "单测生成",
      "definition": "单测生成：口径 = 产出形态 / 目标受众 / 一致性规则 / 机验方式 四件齐备（本条目按 E 段口径框架登记，领域细则待作者补全）。",
      "anchor": "https://peps.python.org/pep-0008/",
      "anchor_kind": "spec",
      "anchor_status": 200,
      "standard_ref": "peps",
      "standard_why": "域码 E13 专属绑定（轮换 0）",
      "standards": [
        {
          "ref": "peps",
          "role": "primary",
          "why": "域码 E13 专属绑定（轮换 0）",
          "layer": "eng",
          "body": "Python",
          "reachable": true,
          "http_status": 200,
          "probe_date": "2026-09-24",
          "depends_on": [
            "rst-docutils"
          ]
        },
        {
          "ref": "mermaid",
          "role": "support",
          "why": "E 段载体锚（轮换 2；与主锚异层）",
          "layer": "form",
          "body": "Mermaid",
          "reachable": true,
          "http_status": 200,
          "probe_date": "2026-09-24",
          "depends_on": []
        }
      ],
      "check": "声明 形态清单 / 受众与可读性口径 / 跨件一致规则 / 可机验项；四项缺一即判「口径未定」（本判据为段级框架，领域专属判据待补）。",
      "pitfall": "只评「好看好用」无判据；跨件风格漂移无规则（E 段常见失效模式；领域专属失效模式待补）。"
    },
    {
      "id": "E13-04",
      "name": "代码评审",
      "definition": "代码评审：口径 = 产出形态 / 目标受众 / 一致性规则 / 机验方式 四件齐备（本条目按 E 段口径框架登记，领域细则待作者补全）。",
      "anchor": "https://peps.python.org/pep-0008/",
      "anchor_kind": "spec",
      "anchor_status": 200,
      "standard_ref": "osi-osd",
      "standard_why": "域码 E13 专属绑定（轮换 1）",
      "standards": [
        {
          "ref": "osi-osd",
          "role": "primary",
          "why": "域码 E13 专属绑定（轮换 1）",
          "layer": "gov",
          "body": "OSI",
          "reachable": true,
          "http_status": 200,
          "probe_date": "2026-09-24",
          "depends_on": []
        },
        {
          "ref": "vega-lite",
          "role": "support",
          "why": "E 段载体锚（轮换 3；与主锚异层）",
          "layer": "form",
          "body": "Vega",
          "reachable": true,
          "http_status": 200,
          "probe_date": "2026-09-24",
          "depends_on": [
            "ietf-json-schema"
          ]
        }
      ],
      "check": "声明 形态清单 / 受众与可读性口径 / 跨件一致规则 / 可机验项；四项缺一即判「口径未定」（本判据为段级框架，领域专属判据待补）。",
      "pitfall": "只评「好看好用」无判据；跨件风格漂移无规则（E 段常见失效模式；领域专属失效模式待补）。"
    },
    {
      "id": "E13-05",
      "name": "缺陷定位",
      "definition": "缺陷定位：口径 = 产出形态 / 目标受众 / 一致性规则 / 机验方式 四件齐备（本条目按 E 段口径框架登记，领域细则待作者补全）。",
      "anchor": "https://peps.python.org/pep-0008/",
      "anchor_kind": "spec",
      "anchor_status": 200,
      "standard_ref": "cwe",
      "standard_why": "关键词「漏洞|缺陷|弱点」命中",
      "standards": [
        {
          "ref": "cwe",
          "role": "primary",
          "why": "关键词「漏洞|缺陷|弱点」命中",
          "layer": "gov",
          "body": "MITRE",
          "reachable": true,
          "http_status": 200,
          "probe_date": "2026-09-24",
          "depends_on": []
        },
        {
          "ref": "w3c-tabular-data",
          "role": "support",
          "why": "E 段载体锚（轮换 4；与主锚异层）",
          "layer": "data",
          "body": "W3C",
          "reachable": true,
          "http_status": 200,
          "probe_date": "2026-09-24",
          "depends_on": [
            "ietf-bcp47"
          ]
        }
      ],
      "check": "声明 形态清单 / 受众与可读性口径 / 跨件一致规则 / 可机验项；四项缺一即判「口径未定」（本判据为段级框架，领域专属判据待补）。",
      "pitfall": "只评「好看好用」无判据；跨件风格漂移无规则（E 段常见失效模式；领域专属失效模式待补）。"
    },
    {
      "id": "E13-06",
      "name": "依赖升级",
      "definition": "依赖升级：口径 = 产出形态 / 目标受众 / 一致性规则 / 机验方式 四件齐备（本条目按 E 段口径框架登记，领域细则待作者补全）。",
      "anchor": "https://peps.python.org/pep-0008/",
      "anchor_kind": "spec",
      "anchor_status": 200,
      "standard_ref": "spdx-3",
      "standard_why": "关键词「供应链|依赖」命中",
      "standards": [
        {
          "ref": "spdx-3",
          "role": "primary",
          "why": "关键词「供应链|依赖」命中",
          "layer": "gov",
          "body": "SPDX",
          "reachable": true,
          "http_status": 200,
          "probe_date": "2026-09-24",
          "depends_on": []
        },
        {
          "ref": "ietf-json-schema",
          "role": "support",
          "why": "E 段载体锚（轮换 0；与主锚异层）",
          "layer": "data",
          "body": "IETF/JSON Schema",
          "reachable": true,
          "http_status": 200,
          "probe_date": "2026-09-24",
          "depends_on": [
            "ietf-json"
          ]
        }
      ],
      "check": "声明 形态清单 / 受众与可读性口径 / 跨件一致规则 / 可机验项；四项缺一即判「口径未定」（本判据为段级框架，领域专属判据待补）。",
      "pitfall": "只评「好看好用」无判据；跨件风格漂移无规则（E 段常见失效模式；领域专属失效模式待补）。"
    },
    {
      "id": "E13-07",
      "name": "文档生成",
      "definition": "文档生成：口径 = 产出形态 / 目标受众 / 一致性规则 / 机验方式 四件齐备（本条目按 E 段口径框架登记，领域细则待作者补全）。",
      "anchor": "https://peps.python.org/pep-0008/",
      "anchor_kind": "spec",
      "anchor_status": 200,
      "standard_ref": "w3c-epub33",
      "standard_why": "关键词「文档|出版|排版|校对」命中",
      "standards": [
        {
          "ref": "w3c-epub33",
          "role": "primary",
          "why": "关键词「文档|出版|排版|校对」命中",
          "layer": "form",
          "body": "W3C",
          "reachable": true,
          "http_status": 200,
          "probe_date": "2026-09-24",
          "depends_on": [
            "w3c-xml"
          ]
        },
        {
          "ref": "commonmark",
          "role": "support",
          "why": "载体锚：产出形态「文本」的承载标准",
          "layer": "form",
          "body": "CommonMark",
          "reachable": true,
          "http_status": 200,
          "probe_date": "2026-09-24",
          "depends_on": []
        }
      ],
      "check": "声明 形态清单 / 受众与可读性口径 / 跨件一致规则 / 可机验项；四项缺一即判「口径未定」（本判据为段级框架，领域专属判据待补）。",
      "pitfall": "只评「好看好用」无判据；跨件风格漂移无规则（E 段常见失效模式；领域专属失效模式待补）。"
    },
    {
      "id": "E13-08",
      "name": "数据管道与 SQL",
      "definition": "数据管道与 SQL：口径 = 产出形态 / 目标受众 / 一致性规则 / 机验方式 四件齐备（本条目按 E 段口径框架登记，领域细则待作者补全）。",
      "anchor": "https://peps.python.org/pep-0008/",
      "anchor_kind": "spec",
      "anchor_status": 200,
      "standard_ref": "osi-osd",
      "standard_why": "域码 E13 专属绑定（轮换 1）",
      "standards": [
        {
          "ref": "osi-osd",
          "role": "primary",
          "why": "域码 E13 专属绑定（轮换 1）",
          "layer": "gov",
          "body": "OSI",
          "reachable": true,
          "http_status": 200,
          "probe_date": "2026-09-24",
          "depends_on": []
        },
        {
          "ref": "mermaid",
          "role": "support",
          "why": "E 段载体锚（轮换 2；与主锚异层）",
          "layer": "form",
          "body": "Mermaid",
          "reachable": true,
          "http_status": 200,
          "probe_date": "2026-09-24",
          "depends_on": []
        }
      ],
      "check": "声明 形态清单 / 受众与可读性口径 / 跨件一致规则 / 可机验项；四项缺一即判「口径未定」（本判据为段级框架，领域专属判据待补）。",
      "pitfall": "只评「好看好用」无判据；跨件风格漂移无规则（E 段常见失效模式；领域专属失效模式待补）。"
    },
    {
      "id": "E13-09",
      "name": "脚手架与模板",